{
  "schema_version": "1.0.0",
  "source_document": {
    "file_name": "synthetic_test_drawing.png",
    "page_index": 0,
    "image_width_px": 900,
    "image_height_px": 700
  },
  "calibration": {
    "unit": "mm",
    "pixel_to_unit_scale": 3.434343,
    "origin_px": [
      0.0,
      700.0
    ],
    "method": "known_dimension_reference",
    "reference_note": "Dùng kích thước '1700' (1700.0 mm) đối chiếu với line rawline-206f4c51 đo được 495.0px -> scale=3.4343 mm/px."
  },
  "primitives": [
    {
      "id": "rawline-ef7faa85",
      "type": "line",
      "source": "geometry_opencv",
      "confidence": 1.0,
      "layer": "UNCLASSIFIED",
      "handle": null,
      "trace": {
        "bbox_px": [
          149.0,
          551.0,
          751.0,
          551.0
        ],
        "extraction_tool": "opencv-canny-hough-v1",
        "extracted_at": "2026-07-16T11:58:57Z"
      },
      "validation": {
        "status": "unreviewed"
      },
      "geometry": {
        "start": {
          "x": 511.717107,
          "y": 511.717107
        },
        "end": {
          "x": 2579.191593,
          "y": 511.717107
        }
      }
    },
    {
      "id": "rawline-3d7f162f",
      "type": "line",
      "source": "geometry_opencv",
      "confidence": 0.998,
      "layer": "UNCLASSIFIED",
      "handle": null,
      "trace": {
        "bbox_px": [
          148.0,
          548.0,
          748.0,
          548.0
        ],
        "extraction_tool": "opencv-canny-hough-v1",
        "extracted_at": "2026-07-16T11:58:57Z"
      },
      "validation": {
        "status": "unreviewed"
      },
      "geometry": {
        "start": {
          "x": 508.28276400000004,
          "y": 522.020136
        },
        "end": {
          "x": 2568.8885640000003,
          "y": 522.020136
        }
      }
    },
    {
      "id": "rawline-206f4c51",
      "type": "line",
      "source": "geometry_opencv",
      "confidence": 0.911,
      "layer": "UNCLASSIFIED",
      "handle": null,
      "trace": {
        "bbox_px": [
          148.0,
          52.0,
          148.0,
          547.0
        ],
        "extraction_tool": "opencv-canny-hough-v1",
        "extracted_at": "2026-07-16T11:58:57Z"
      },
      "validation": {
        "status": "unreviewed"
      },
      "geometry": {
        "start": {
          "x": 508.28276400000004,
          "y": 525.454479
        },
        "end": {
          "x": 508.28276400000004,
          "y": 2225.454264
        }
      }
    },
    {
      "id": "rawline-e8b01d57",
      "type": "line",
      "source": "geometry_opencv",
      "confidence": 0.913,
      "layer": "UNCLASSIFIED",
      "handle": null,
      "trace": {
        "bbox_px": [
          151.0,
          49.0,
          151.0,
          546.0
        ],
        "extraction_tool": "opencv-canny-hough-v1",
        "extracted_at": "2026-07-16T11:58:57Z"
      },
      "validation": {
        "status": "unreviewed"
      },
      "geometry": {
        "start": {
          "x": 518.585793,
          "y": 528.888822
        },
        "end": {
          "x": 518.585793,
          "y": 2235.757293
        }
      }
    },
    {
      "id": "rawline-9098537f",
      "type": "line",
      "source": "geometry_opencv",
      "confidence": 0.586,
      "layer": "UNCLASSIFIED",
      "handle": null,
      "trace": {
        "bbox_px": [
          633.0,
          654.0,
          736.0,
          654.0
        ],
        "extraction_tool": "opencv-canny-hough-v1",
        "extracted_at": "2026-07-16T11:58:57Z"
      },
      "validation": {
        "status": "unreviewed"
      },
      "geometry": {
        "start": {
          "x": 2173.939119,
          "y": 157.979778
        },
        "end": {
          "x": 2527.676448,
          "y": 157.979778
        }
      }
    },
    {
      "id": "rawline-d50f7a43",
      "type": "line",
      "source": "geometry_opencv",
      "confidence": 0.576,
      "layer": "UNCLASSIFIED",
      "handle": null,
      "trace": {
        "bbox_px": [
          645.0,
          650.0,
          736.0,
          651.0
        ],
        "extraction_tool": "opencv-canny-hough-v1",
        "extracted_at": "2026-07-16T11:58:57Z"
      },
      "validation": {
        "status": "unreviewed"
      },
      "geometry": {
        "start": {
          "x": 2215.1512350000003,
          "y": 168.28280700000002
        },
        "end": {
          "x": 2527.676448,
          "y": 171.71715
        }
      }
    },
    {
      "id": "rawcirc-9cbe4779",
      "type": "circle",
      "source": "geometry_opencv",
      "confidence": 0.75,
      "layer": "UNCLASSIFIED",
      "handle": null,
      "trace": {
        "bbox_px": [
          429.29998779296875,
          279.29998779296875,
          469.70001220703125,
          319.70001220703125
        ],
        "extraction_tool": "opencv-canny-hough-v1",
        "extracted_at": "2026-07-16T11:58:57Z"
      },
      "validation": {
        "status": "unreviewed"
      },
      "geometry": {
        "center": {
          "x": 1543.7371785,
          "y": 1375.4543715
        },
        "radius": 69.37373122019578
      }
    },
    {
      "id": "rawtext-7aae9857",
      "type": "text",
      "source": "text_tesseract",
      "confidence": 0.73,
      "layer": "UNCLASSIFIED",
      "handle": null,
      "trace": {
        "bbox_px": [
          580,
          644,
          736,
          659
        ],
        "extraction_tool": "tesseract-5.3",
        "extracted_at": "2026-07-16T11:58:57Z"
      },
      "validation": {
        "status": "unreviewed"
      },
      "text_data": {
        "content": "TP-TL-A001/07/26",
        "position": {
          "x": 1991.91894,
          "y": 192.32320800000002
        },
        "rotation_deg": 0.0,
        "height": 51.515,
        "parsed_value": null,
        "semantic_role": "drawing_code"
      }
    },
    {
      "id": "rawtext-71581cef",
      "type": "text",
      "source": "text_vision",
      "confidence": 0.95,
      "layer": "UNCLASSIFIED",
      "handle": null,
      "trace": {
        "bbox_px": [
          90,
          245,
          220,
          400
        ],
        "extraction_tool": "claude-vision",
        "extracted_at": "2026-07-16T11:58:57Z"
      },
      "validation": {
        "status": "unreviewed"
      },
      "text_data": {
        "content": "1700",
        "position": {
          "x": 309.09087,
          "y": 1562.6260650000002
        },
        "rotation_deg": 90.0,
        "height": 532.323,
        "parsed_value": 1700.0,
        "semantic_role": "dimension_value"
      }
    }
  ],
  "cross_validations": [
    {
      "id": "cv-0217fd3c",
      "text_primitive_id": "rawtext-71581cef",
      "geometry_primitive_id": "rawline-206f4c51",
      "status": "confirmed",
      "match_threshold_percent": 3.0,
      "text_value": 1700.0,
      "geometry_measured_length": 1700.0,
      "delta_percent": 0.0
    }
  ]
}